title,publisher,link,providerPublishTime
Compounded GLP-1s are a 'symptom' of supply shortage: Ro CEO,Yahoo Finance Video,https://finance.yahoo.com/video/compounded-glp-1s-symptom-supply-210041450.html,2024-10-23 21:00:41
Goldman Sachs: Eli Lilly and Company (NYSE:LLY) Has Got Mutual & Hedge Fund Managers Divided,Insider Monkey,https://finance.yahoo.com/news/goldman-sachs-eli-lilly-company-192023663.html,2024-10-23 19:20:23
Is Eli Lilly Stock A Sell After U.K. Officials — But Not Insurers — Sign Off On Alzheimer's Drug?,Investor's Business Daily,https://finance.yahoo.com/m/75ad41f4-79f0-3b48-af19-38b6a6e1e059/is-eli-lilly-stock-a-sell.html,2024-10-23 18:06:42
Eli Lilly (LLY) Earnings Expected to Grow: What to Know Ahead of Next Week's Release,Zacks,https://finance.yahoo.com/news/eli-lilly-lly-earnings-expected-140206133.html,2024-10-23 14:02:06
"Update: Eli Lilly's Alzheimer's Treatment Donanemab Deemed Not Cost-Effective for NHS use, UK Health Body Says",MT Newswires,https://finance.yahoo.com/news/eli-lilly-apos-alzheimer-apos-134756262.html,2024-10-23 13:47:56
Eli Lilly (LLY): A Leader in Pharmaceutical Innovation and Growth,Insider Monkey,https://finance.yahoo.com/news/eli-lilly-lly-leader-pharmaceutical-134553162.html,2024-10-23 13:45:53
"Pfizer, Lilly pressed about telehealth prescriber relationships, STAT reports",TipRanks,https://finance.yahoo.com/news/pfizer-lilly-pressed-telehealth-prescriber-132554281.html,2024-10-23 13:25:54
England’s Drug-Cost Watchdog Rejects Eli Lilly’s Alzheimer’s Drug,The Wall Street Journal,https://finance.yahoo.com/m/b31c1eff-295c-3c7a-84a8-bf6ff9e1f3d2/england%E2%80%99s-drug-cost-watchdog.html,2024-10-23 12:42:00
