title,publisher,link,providerPublishTime
"Abbott Laboratories Insider Sold Shares Worth $18,424,298, According to a Recent SEC Filing",MT Newswires,https://finance.yahoo.com/news/abbott-laboratories-insider-sold-shares-211710713.html,2024-10-23 21:17:10
Organic Growth and Margin Expansion Make Abbott Laboratories (ABT) A Solid Investment,Insider Monkey,https://finance.yahoo.com/news/organic-growth-margin-expansion-abbott-170323812.html,2024-10-23 17:03:23
"Growing Biosimilars Business Supports ABT Stock, Macro Issues Hurt",Zacks,https://finance.yahoo.com/news/growing-biosimilars-business-supports-abt-162000350.html,2024-10-23 16:20:00
Daiwa Securities Adjusts Price Target on Abbott Laboratories to $125 From $120,MT Newswires,https://finance.yahoo.com/news/daiwa-securities-adjusts-price-target-144519238.html,2024-10-23 14:45:19
Abbott Laboratories (ABT) Is a Trending Stock: Facts to Know Before Betting on It,Zacks,https://finance.yahoo.com/news/abbott-laboratories-abt-trending-stock-130011628.html,2024-10-23 13:00:11
"Top Research Reports for Visa, Netflix & Merck",Zacks,https://finance.yahoo.com/news/top-research-reports-visa-netflix-205200957.html,2024-10-21 20:52:00
Argus Adjusts Price Target on Abbott Laboratories to $145 From $135,MT Newswires,https://finance.yahoo.com/news/argus-adjusts-price-target-abbott-121703131.html,2024-10-21 12:17:03
Want Decades of Passive Income? 2 Stocks to Buy Now and Hold Forever,Motley Fool,https://finance.yahoo.com/m/d5cb900a-ccb2-381b-98aa-a79685accc01/want-decades-of-passive.html,2024-10-19 13:57:00
