title,publisher,link,providerPublishTime
Intuitive Surgical (ISRG) Is Considered a Good Investment by Brokers: Is That True?,Zacks,https://finance.yahoo.com/news/intuitive-surgical-isrg-considered-good-133011990.html,2024-10-23 13:30:11
"Thermo Fisher Q3 Earnings Top Estimates, Revenues Miss, Stock Dips",Zacks,https://finance.yahoo.com/news/thermo-fisher-q3-earnings-top-131700960.html,2024-10-23 13:17:00
"Intuitive Surgical Insider Sold Shares Worth $1,314,795, According to a Recent SEC Filing",MT Newswires,https://finance.yahoo.com/news/intuitive-surgical-insider-sold-shares-123313415.html,2024-10-23 12:33:13
Has Intuitive Surgical (NASDAQ:ISRG) Stock’s Valuation Gotten Out of Hand?,TipRanks,https://finance.yahoo.com/news/intuitive-surgical-nasdaq-isrg-stock-082818887.html,2024-10-23 08:28:18
Argus Adjusts Price Target on Intuitive Surgical to $570 From $520,MT Newswires,https://finance.yahoo.com/news/argus-adjusts-price-target-intuitive-140755667.html,2024-10-22 14:07:55
"Up 800% the Past Decade, Can the Momentum Continue for This Hot Stock?",Motley Fool,https://finance.yahoo.com/m/256eadf4-3d85-3db4-8c03-d5ddeb2b41ff/up-800%25-the-past-decade%2C-can.html,2024-10-22 13:53:00
Analyst Report: Intuitive Surgical Inc,Argus Research,https://finance.yahoo.com/m/87235bc1-048d-3322-a5f0-35e633dc598d/analyst-report%3A-intuitive.html,2024-10-22 11:54:53
"Market Digest: BX, CSX, DFS, ISRG, TRV",Argus Research,https://finance.yahoo.com/m/9d9220be-1185-30d4-9d2c-960dd2682a08/market-digest%3A-bx%2C-csx%2C-dfs%2C.html,2024-10-22 11:39:53
