title,publisher,link,providerPublishTime
Goldman Sachs: Visa Inc. (NYSE:V) Is A Stock Both Hedge & Mutual Funds Love,Insider Monkey,https://finance.yahoo.com/news/goldman-sachs-visa-inc-nyse-235556625.html,2024-10-23 23:55:56
"Coinbase Global, Inc. (COIN) Earnings Expected to Grow: What to Know Ahead of Next Week's Release",Zacks,https://finance.yahoo.com/news/coinbase-global-inc-coin-earnings-140148517.html,2024-10-23 14:01:48
Brokers Suggest Investing in Visa (V): Read This Before Placing a Bet,Zacks,https://finance.yahoo.com/news/brokers-suggest-investing-visa-v-133012001.html,2024-10-23 13:30:12
Why This 1 Business Services Stock Could Be a Great Addition to Your Portfolio,Zacks,https://finance.yahoo.com/news/why-1-business-services-stock-133004169.html,2024-10-23 13:30:04
"Criminals Reverting to Old-School Tactics with New Twists, Visa’s State of Scams Report Shows",Business Wire,https://finance.yahoo.com/news/criminals-reverting-old-school-tactics-120000630.html,2024-10-23 12:00:00
Here's Why Visa (V) Fell More Than Broader Market,Zacks,https://finance.yahoo.com/news/heres-why-visa-v-fell-214519502.html,2024-10-22 21:45:19
Visa (V) Reports Next Week: Wall Street Expects Earnings Growth,Zacks,https://finance.yahoo.com/news/visa-v-reports-next-week-140118952.html,2024-10-22 14:01:18
"Insiders At Visa Sold US$7.2m In Stock, Alluding To Potential Weakness",Simply Wall St.,https://finance.yahoo.com/news/insiders-visa-sold-us-7-140014765.html,2024-10-22 14:00:14
