title,publisher,link,providerPublishTime
Intuit Inc.'s (NASDAQ:INTU) Intrinsic Value Is Potentially 58% Above Its Share Price,Simply Wall St.,https://finance.yahoo.com/news/intuit-inc-nasdaq-intu-intrinsic-120016497.html,2024-10-22 12:00:16
Intuit Inc. (INTU): This High Growth Software Stock Is Profitable In 2024,Insider Monkey,https://finance.yahoo.com/news/intuit-inc-intu-high-growth-194936511.html,2024-10-20 19:49:36
Intuit Inc. (INTU): This Fintech Stock Is Riding the AI Wave Higher,Insider Monkey,https://finance.yahoo.com/news/intuit-inc-intu-fintech-stock-094547499.html,2024-10-18 09:45:47
Intuit Inc. (INTU) Is a Trending Stock: Facts to Know Before Betting on It,Zacks,https://finance.yahoo.com/news/intuit-inc-intu-trending-stock-130014554.html,2024-10-17 13:00:14
Exploring High Growth Tech Stocks in the United States,Simply Wall St.,https://finance.yahoo.com/news/exploring-high-growth-tech-stocks-100250147.html,2024-10-16 10:02:50
Intuit QuickBooks Report Reveals Small Businesses Project a Third of Yearly Revenue from Holiday Sales as Consumer Spending Expected to Decrease by 34%,Business Wire,https://finance.yahoo.com/news/intuit-quickbooks-report-reveals-small-123000149.html,2024-10-15 12:30:00
Intuit (INTU) Upgraded to Buy: What Does It Mean for the Stock?,Zacks,https://finance.yahoo.com/news/intuit-intu-upgraded-buy-does-160009706.html,2024-10-14 16:00:09
Is Intuit Inc. (INTU) the Most Profitable Large Cap Stock to Invest In?,Insider Monkey,https://finance.yahoo.com/news/intuit-inc-intu-most-profitable-191358803.html,2024-10-13 19:13:58
