title,publisher,link,providerPublishTime
Veren Inc. (NYSE:VRN): Among The 10 Oversold Canadian Stocks to Buy Right Now,Insider Monkey,https://finance.yahoo.com/news/veren-inc-nyse-vrn-among-054715509.html,2024-10-24 05:47:15
Ipsos: Slowdown in activity in a more difficult business climate,GlobeNewswire,https://finance.yahoo.com/news/ipsos-slowdown-activity-more-difficult-054600456.html,2024-10-24 05:46:00
SAVENCIA: Activity at the end of September 2024,GlobeNewswire,https://finance.yahoo.com/news/savencia-activity-end-september-2024-054600913.html,2024-10-24 05:46:00
Abortion film shows impact of Texas ban ahead of US election,AFP,https://finance.yahoo.com/m/51fb489d-35b2-3e40-aa9b-9cd7cccdbc69/abortion-film-shows-impact-of.html,2024-10-24 05:45:17
Baytex Energy Corp. (NYSE:BTE): Among The 10 Oversold Canadian Stocks to Buy Right Now,Insider Monkey,https://finance.yahoo.com/news/baytex-energy-corp-nyse-bte-054509164.html,2024-10-24 05:45:09
IIITH's social incubator hosts Roundtable on Startup Innovation in Climate Action,PR Newswire,https://finance.yahoo.com/news/iiiths-social-incubator-hosts-roundtable-054400293.html,2024-10-24 05:44:00
Nvidia rolls out Hindi-language AI model in India as CEO Huang visits,Reuters,https://finance.yahoo.com/news/nvidia-rolls-hindi-language-ai-054314840.html,2024-10-24 05:43:14
Vermilion Energy Inc. (NYSE:VET): Among The 10 Oversold Canadian Stocks to Buy Right Now,Insider Monkey,https://finance.yahoo.com/news/vermilion-energy-inc-nyse-vet-054217705.html,2024-10-24 05:42:17
