title,publisher,link,providerPublishTime
Coca-Cola Beats Earnings. Why the Stock Is Falling.,Barrons.com,https://finance.yahoo.com/m/3f3f976a-3fce-3451-928f-5f67f17a7383/coca-cola-beats-earnings.-why.html,2024-10-23 14:23:00
"Coca-Cola posts better-than-expected Q3 report, driven by higher prices",Yahoo Finance,https://finance.yahoo.com/news/coca-cola-posts-better-than-expected-q3-report-driven-by-higher-prices-111045463.html,2024-10-23 12:58:24
"Celsius Holdings, Inc. (CELH): A Bear Case Theory",Insider Monkey,https://finance.yahoo.com/news/celsius-holdings-inc-celh-bear-214631450.html,2024-10-22 21:46:31
Why PepsiCo (PEP) is a Top Momentum Stock for the Long-Term,Zacks,https://finance.yahoo.com/news/why-pepsico-pep-top-momentum-135010089.html,2024-10-22 13:50:10
Celsius Holdings price target lowered to $68 from $72 at Ladenburg,TipRanks,https://finance.yahoo.com/news/celsius-holdings-price-target-lowered-121525047.html,2024-10-22 12:15:25
What Is the Dividend Payout for PepsiCo?,Motley Fool,https://finance.yahoo.com/m/a63fa5af-6305-36f6-a138-a4da5fc63355/what-is-the-dividend-payout.html,2024-10-20 10:51:00
"Why PepsiCo, Cadence Bank And Entergy Are Winners For Passive Income",Benzinga,https://finance.yahoo.com/news/why-pepsico-cadence-bank-entergy-000042880.html,2024-10-20 00:00:42
"Is PepsiCo, Inc. (PEP) the Stock With the Lowest Short Interest to Buy?",Insider Monkey,https://finance.yahoo.com/news/pepsico-inc-pep-stock-lowest-235318771.html,2024-10-19 23:53:18
